{
  "schema": "graphforge-gdc-acquisition/1",
  "suite_id": "snb-bi",
  "recorded_spec": {
    "name": "ldbc_snb_docs",
    "source": "https://github.com/ldbc/ldbc_snb_docs",
    "release": "v2.2.4",
    "commit": "5f7956e07a214373c363b371a3b88bc83ddcd118"
  },
  "recorded_generator": {
    "name": "graphforge_synthetic_snb_bi_fixture",
    "source": "https://github.com/CurateLabs/graphforge",
    "provenance_kind": "content_addressed_synthetic",
    "content_sha256": "c0fd57903065bb4950244cc77023e9ce0803f723596922b114141f190ea521d8",
    "content_description": "exact committed synthetic static fixture bytes"
  },
  "recorded_driver": {
    "name": "graphforge_benchmark_gdc_snb_bi",
    "source": "https://github.com/CurateLabs/graphforge",
    "provenance_kind": "repository_source",
    "content_sha256": "43a77834dbd4932d9fcc904e5e25be86e450b823150522a0e7b31cc73f0edf4a",
    "content_description": "sha256 of sorted runner Cargo.toml and src path-content framing"
  },
  "assets": [
    {
      "id": "snb-bi-sf0.003",
      "path": "snb-bi-sf0.003.graph",
      "checksum_sha256": "c0fd57903065bb4950244cc77023e9ce0803f723596922b114141f190ea521d8",
      "license": "Apache-2.0",
      "acquisition": "fixture"
    }
  ],
  "references": [
    {
      "dataset_id": "snb-bi-sf0.003",
      "workload_key": "bi-validation",
      "path": "bi-validation.ref",
      "checksum_sha256": "20368ad845455de99ef737732930bf7d07d9d44adde19a31ec7ba6ec332b25db"
    }
  ]
}
